{
  "artifact": "TFII_Tokenized_Fund_Collateral_Admission_Control_001",
  "version": "1.0.0",
  "as_of": "2026-07-16",
  "status": "CONTROLLED_VALIDATED",
  "purpose": "Fail closed before a tokenized fund enters a collateral eligibility query unless its financial object, record architecture and program-specific admission evidence are established at the decision boundary.",
  "source": {
    "public_sample": "Technical Contributions/fixtures/TFII-Public-Sample-v1.0.json",
    "conformance_test": "Technical Contributions/tfii-finos-cdm-conformance-test-001.json",
    "gdf_report": "https://www.gdf.io/wp-content/uploads/2026/07/6.07.26_Unlocking-Capital-with-U.S-Tokenized-Money-Market-Funds-for-Collateral-Mobility.pdf",
    "finos_revision": "a6ffe777bc12ef3d289579cb3a86d1cbffea63d2"
  },
  "gdf_production_gap": {
    "sandbox_assumptions": [
      "test assets only",
      "no real fund interests transferred",
      "no legal obligations created",
      "one dollar price per token unit",
      "standard haircut across instruments",
      "eligible asset list pre-agreed between pledgor and receiver"
    ],
    "production_requirements": [
      "authoritative ownership record",
      "settlement finality and transfer effectiveness",
      "wallet and transfer controls",
      "reconciliation across token, fund entitlement and collateral records",
      "accepted valuation and haircut treatment",
      "product-level collateral acceptance",
      "default access and liquidation mechanics"
    ],
    "control_response": "TFII establishes a fail-closed integrity precheck before native CDM collateral-criteria matching. Missing mandatory evidence remains UNKNOWN and blocks query execution without declaring the instrument eligible, ineligible, safe or unsafe."
  },
  "control_sequence": [
    {
      "step": 1,
      "name": "identify financial object",
      "pass_condition": "Exact instrument and issuer are source-bound.",
      "fail_closed_result": "HOLD_MISSING_EVIDENCE"
    },
    {
      "step": 2,
      "name": "establish record integrity",
      "pass_condition": "Authoritative record, chain role, transfer boundary, record keeper, processing, correction, reconciliation, wallet controls, valuation, rights and coverage are established.",
      "fail_closed_result": "HOLD_MISSING_EVIDENCE"
    },
    {
      "step": 3,
      "name": "establish program-specific admission evidence",
      "pass_condition": "Governing schedule, receiver acceptance, position, valuation, haircut, concentration, custody/control, default access and freshness are established.",
      "fail_closed_result": "HOLD_MISSING_EVIDENCE"
    },
    {
      "step": 4,
      "name": "invoke CDM eligibility query",
      "pass_condition": "Steps 1 through 3 pass and a complete query can be constructed.",
      "fail_closed_result": "CDM_QUERY_NOT_RUN"
    },
    {
      "step": 5,
      "name": "preserve decision boundary",
      "pass_condition": "The precheck and CDM result are retained as decision inputs subject to independent legal, operational and risk approval.",
      "fail_closed_result": "NO_ADMISSION_DECISION"
    }
  ],
  "requirement_catalog": [
    {
      "requirement_id": "TFII-AC-001",
      "layer": "ARCHITECTURE_INTEGRITY",
      "field": "instrument_identity",
      "question": "Is the exact financial instrument identified?",
      "mandatory": true,
      "public_sample_key": "subject",
      "unknown_effect": "HOLD_MISSING_EVIDENCE"
    },
    {
      "requirement_id": "TFII-AC-002",
      "layer": "ARCHITECTURE_INTEGRITY",
      "field": "architecture_class",
      "question": "Is the ownership-record architecture classified?",
      "mandatory": true,
      "public_sample_key": "architecture_class",
      "unknown_effect": "HOLD_MISSING_EVIDENCE"
    },
    {
      "requirement_id": "TFII-AC-003",
      "layer": "ARCHITECTURE_INTEGRITY",
      "field": "authoritative_record",
      "question": "Which ledger, register or book controls ownership?",
      "mandatory": true,
      "public_sample_key": "authoritative_record",
      "unknown_effect": "HOLD_MISSING_EVIDENCE"
    },
    {
      "requirement_id": "TFII-AC-004",
      "layer": "ARCHITECTURE_INTEGRITY",
      "field": "chain_role",
      "question": "What role does the blockchain play in the official record?",
      "mandatory": true,
      "public_sample_key": "chain_role",
      "unknown_effect": "HOLD_MISSING_EVIDENCE"
    },
    {
      "requirement_id": "TFII-AC-005",
      "layer": "ARCHITECTURE_INTEGRITY",
      "field": "transfer_effective_event",
      "question": "Which event makes ownership or entitlement effective?",
      "mandatory": true,
      "public_sample_key": "transfer_effective_event",
      "unknown_effect": "HOLD_MISSING_EVIDENCE"
    },
    {
      "requirement_id": "TFII-AC-006",
      "layer": "ARCHITECTURE_INTEGRITY",
      "field": "record_keeper",
      "question": "Which party maintains the governing record?",
      "mandatory": true,
      "public_sample_key": "record_keeper",
      "unknown_effect": "HOLD_MISSING_EVIDENCE"
    },
    {
      "requirement_id": "TFII-AC-007",
      "layer": "ARCHITECTURE_INTEGRITY",
      "field": "processing_calendar",
      "question": "When can the governing record process the relevant transfer or redemption?",
      "mandatory": true,
      "public_sample_key": "processing_calendar",
      "unknown_effect": "HOLD_MISSING_EVIDENCE"
    },
    {
      "requirement_id": "TFII-AC-008",
      "layer": "ARCHITECTURE_INTEGRITY",
      "field": "correction_hierarchy",
      "question": "Which party and record control after a divergence?",
      "mandatory": true,
      "public_sample_key": "correction_hierarchy",
      "unknown_effect": "HOLD_MISSING_EVIDENCE"
    },
    {
      "requirement_id": "TFII-AC-009",
      "layer": "ARCHITECTURE_INTEGRITY",
      "field": "reconciliation",
      "question": "Are comparison cadence, direction and exception handling established?",
      "mandatory": true,
      "public_sample_key": null,
      "unknown_effect": "HOLD_MISSING_EVIDENCE"
    },
    {
      "requirement_id": "TFII-AC-010",
      "layer": "ARCHITECTURE_INTEGRITY",
      "field": "wallet_eligibility",
      "question": "Are wallet, holder, allowlist and transfer controls established?",
      "mandatory": true,
      "public_sample_key": null,
      "unknown_effect": "HOLD_MISSING_EVIDENCE"
    },
    {
      "requirement_id": "TFII-AC-011",
      "layer": "ARCHITECTURE_INTEGRITY",
      "field": "valuation_clock",
      "question": "Is the governing valuation boundary and source established?",
      "mandatory": true,
      "public_sample_key": null,
      "unknown_effect": "HOLD_MISSING_EVIDENCE"
    },
    {
      "requirement_id": "TFII-AC-012",
      "layer": "ARCHITECTURE_INTEGRITY",
      "field": "rights_state",
      "question": "Are source and downstream-use rights bounded?",
      "mandatory": true,
      "public_sample_key": "rights_state",
      "unknown_effect": "HOLD_MISSING_EVIDENCE"
    },
    {
      "requirement_id": "TFII-AC-013",
      "layer": "ARCHITECTURE_INTEGRITY",
      "field": "coverage_and_unknowns",
      "question": "Are public-source coverage and unresolved evidence explicit?",
      "mandatory": true,
      "public_sample_key": "__coverage__",
      "unknown_effect": "HOLD_MISSING_EVIDENCE"
    },
    {
      "requirement_id": "TFII-AC-014",
      "layer": "PROGRAM_SPECIFIC_ADMISSION",
      "field": "governing_collateral_schedule",
      "question": "Does a governing collateral agreement or schedule include this instrument?",
      "mandatory": true,
      "public_sample_key": null,
      "unknown_effect": "HOLD_MISSING_EVIDENCE"
    },
    {
      "requirement_id": "TFII-AC-015",
      "layer": "PROGRAM_SPECIFIC_ADMISSION",
      "field": "receiver_acceptance",
      "question": "Has the secured party, CCP, custodian or other receiver accepted the instrument?",
      "mandatory": true,
      "public_sample_key": null,
      "unknown_effect": "HOLD_MISSING_EVIDENCE"
    },
    {
      "requirement_id": "TFII-AC-016",
      "layer": "PROGRAM_SPECIFIC_ADMISSION",
      "field": "position_control_and_encumbrance",
      "question": "Are the live position, owner, control and encumbrance state established?",
      "mandatory": true,
      "public_sample_key": null,
      "unknown_effect": "HOLD_MISSING_EVIDENCE"
    },
    {
      "requirement_id": "TFII-AC-017",
      "layer": "PROGRAM_SPECIFIC_ADMISSION",
      "field": "program_valuation",
      "question": "Is a fresh valuation accepted by the collateral program available?",
      "mandatory": true,
      "public_sample_key": null,
      "unknown_effect": "HOLD_MISSING_EVIDENCE"
    },
    {
      "requirement_id": "TFII-AC-018",
      "layer": "PROGRAM_SPECIFIC_ADMISSION",
      "field": "haircut",
      "question": "Is the applicable haircut or margin percentage established?",
      "mandatory": true,
      "public_sample_key": null,
      "unknown_effect": "HOLD_MISSING_EVIDENCE"
    },
    {
      "requirement_id": "TFII-AC-019",
      "layer": "PROGRAM_SPECIFIC_ADMISSION",
      "field": "concentration_limit",
      "question": "Are applicable position and concentration limits established?",
      "mandatory": true,
      "public_sample_key": null,
      "unknown_effect": "HOLD_MISSING_EVIDENCE"
    },
    {
      "requirement_id": "TFII-AC-020",
      "layer": "PROGRAM_SPECIFIC_ADMISSION",
      "field": "custody_control_and_perfection",
      "question": "Are custody, control and any required legal-perfection conditions established?",
      "mandatory": true,
      "public_sample_key": null,
      "unknown_effect": "HOLD_MISSING_EVIDENCE"
    },
    {
      "requirement_id": "TFII-AC-021",
      "layer": "PROGRAM_SPECIFIC_ADMISSION",
      "field": "default_access_and_liquidation",
      "question": "Can the receiver access, enforce against and liquidate the asset under the governing arrangement?",